{
  "$schema": "widgets.schema.json",
  "schemaVersion": 1,
  "compatibilityVersion": 1,
  "id": "litheview.widgets.builtin",
  "displayName": "LitheView Built-in Widgets",
  "properties": [
    {
      "id": "frame",
      "displayName": "Frame",
      "kind": "rectangle",
      "xmlName": "frame",
      "xmlAliases": [],
      "xmlTransform": "direct",
      "cppMember": "spec.frame",
      "defaultValue": [0, 0, 1, 1],
      "required": true,
      "enumValues": [],
      "documentation": "Integer x, y, width, and height relative to the parent; width and height are positive."
    },
    {
      "id": "runtime-id",
      "displayName": "Runtime ID",
      "kind": "unsignedInteger",
      "xmlName": "runtimeID",
      "xmlAliases": ["id"],
      "xmlTransform": "direct",
      "cppMember": "spec.id",
      "defaultValue": 0,
      "minimum": 0,
      "maximum": 65535,
      "required": false,
      "enumValues": [],
      "documentation": "Optional 16-bit runtime view and default action identifier; zero means unassigned."
    },
    {
      "id": "background-color",
      "displayName": "Background Color",
      "kind": "color",
      "xmlName": "backgroundColor",
      "xmlAliases": [],
      "xmlTransform": "direct",
      "cppMember": "spec.style.background",
      "defaultValue": "#00000000",
      "required": false,
      "enumValues": [],
      "documentation": "RGBA background color; a transparent value leaves the existing surface visible."
    },
    {
      "id": "foreground-color",
      "displayName": "Foreground Color",
      "kind": "color",
      "xmlName": "textColor",
      "xmlAliases": ["foregroundColor"],
      "xmlTransform": "direct",
      "cppMember": "spec.style.foreground",
      "defaultValue": "#FFFFFFFF",
      "required": false,
      "enumValues": [],
      "documentation": "RGBA foreground color used for text and primary strokes."
    },
    {
      "id": "accent-color",
      "displayName": "Accent Color",
      "kind": "color",
      "xmlName": "accentColor",
      "xmlAliases": [],
      "xmlTransform": "direct",
      "cppMember": "spec.style.accent",
      "defaultValue": "#2D6CDFFF",
      "required": false,
      "enumValues": [],
      "documentation": "RGBA accent color used for selection, progress, focus, and active state."
    },
    {
      "id": "border-color",
      "displayName": "Border Color",
      "kind": "color",
      "xmlName": "borderColor",
      "xmlAliases": [],
      "xmlTransform": "direct",
      "cppMember": "spec.style.border",
      "defaultValue": "#00000000",
      "required": false,
      "enumValues": [],
      "documentation": "RGBA border color; transparent disables a visible border even when width is nonzero."
    },
    {
      "id": "focused-background-color",
      "displayName": "Focused Background Color",
      "kind": "color",
      "xmlName": "focusedBackgroundColor",
      "xmlAliases": [],
      "xmlTransform": "direct",
      "cppMember": "state.focusedBackground",
      "defaultValue": "#00DF6C2D",
      "required": false,
      "enumValues": [],
      "documentation": "Bounded focused-state background token. Named theme colors may be selected instead of a literal."
    },
    {
      "id": "focused-foreground-color",
      "displayName": "Focused Foreground Color",
      "kind": "color",
      "xmlName": "focusedForegroundColor",
      "xmlAliases": [],
      "xmlTransform": "direct",
      "cppMember": "state.focusedForeground",
      "defaultValue": "#00FFFFFF",
      "required": false,
      "enumValues": [],
      "documentation": "Bounded focused-state text and stroke token. Named theme colors may be selected instead of a literal."
    },
    {
      "id": "pressed-background-color",
      "displayName": "Pressed Background Color",
      "kind": "color",
      "xmlName": "pressedBackgroundColor",
      "xmlAliases": [],
      "xmlTransform": "direct",
      "cppMember": "state.pressedBackground",
      "defaultValue": "#00B35724",
      "required": false,
      "enumValues": [],
      "documentation": "Bounded pointer-pressed background token. Named theme colors may be selected instead of a literal."
    },
    {
      "id": "pressed-foreground-color",
      "displayName": "Pressed Foreground Color",
      "kind": "color",
      "xmlName": "pressedForegroundColor",
      "xmlAliases": [],
      "xmlTransform": "direct",
      "cppMember": "state.pressedForeground",
      "defaultValue": "#00FFFFFF",
      "required": false,
      "enumValues": [],
      "documentation": "Bounded pointer-pressed text and stroke token. Named theme colors may be selected instead of a literal."
    },
    {
      "id": "disabled-background-color",
      "displayName": "Disabled Background Color",
      "kind": "color",
      "xmlName": "disabledBackgroundColor",
      "xmlAliases": [],
      "xmlTransform": "direct",
      "cppMember": "state.disabledBackground",
      "defaultValue": "#00DCD4D0",
      "required": false,
      "enumValues": [],
      "documentation": "Bounded disabled-state background token. Named theme colors may be selected instead of a literal."
    },
    {
      "id": "disabled-foreground-color",
      "displayName": "Disabled Foreground Color",
      "kind": "color",
      "xmlName": "disabledForegroundColor",
      "xmlAliases": [],
      "xmlTransform": "direct",
      "cppMember": "state.disabledForeground",
      "defaultValue": "#00786F6A",
      "required": false,
      "enumValues": [],
      "documentation": "Bounded disabled-state text and stroke token. Named theme colors may be selected instead of a literal."
    },
    {
      "id": "selected-background-color",
      "displayName": "Selected Background Color",
      "kind": "color",
      "xmlName": "selectedBackgroundColor",
      "xmlAliases": [],
      "xmlTransform": "direct",
      "cppMember": "state.selectedBackground",
      "defaultValue": null,
      "required": false,
      "enumValues": [],
      "documentation": "Bounded selected-state background token for a latched toggle button, checked checkbox, or selected radio button. Omitted keeps the normal background; disabled, pressed, and focused states take precedence. Named theme colors may be selected instead of a literal."
    },
    {
      "id": "selected-foreground-color",
      "displayName": "Selected Foreground Color",
      "kind": "color",
      "xmlName": "selectedForegroundColor",
      "xmlAliases": [],
      "xmlTransform": "direct",
      "cppMember": "state.selectedForeground",
      "defaultValue": null,
      "required": false,
      "enumValues": [],
      "documentation": "Bounded selected-state text, icon, and stroke token. Omitted keeps the normal foreground. Named theme colors may be selected instead of a literal."
    },
    {
      "id": "text-alignment-flags",
      "displayName": "Text Alignment",
      "kind": "unsignedInteger",
      "xmlName": "textAlignmentFlags",
      "xmlAliases": [],
      "xmlTransform": "direct",
      "cppMember": "spec.style.textAlign",
      "defaultValue": 12,
      "minimum": 0,
      "maximum": 15,
      "required": false,
      "enumValues": [],
      "documentation": "Legacy four-bit horizontal and vertical text-alignment encoding."
    },
    {
      "id": "text-scale",
      "displayName": "Text Scale",
      "kind": "unsignedInteger",
      "xmlName": "textScale",
      "xmlAliases": [],
      "xmlTransform": "direct",
      "cppMember": "spec.style.textScale",
      "defaultValue": 1,
      "minimum": 1,
      "maximum": 8,
      "units": "integer scale",
      "required": false,
      "enumValues": [],
      "documentation": "Integer nearest-neighbor scale applied by the selected font backend."
    },
    {
      "id": "border-width",
      "displayName": "Border Width",
      "kind": "unsignedInteger",
      "xmlName": "borderWidth",
      "xmlAliases": [],
      "xmlTransform": "direct",
      "cppMember": "spec.style.borderWidth",
      "defaultValue": 0,
      "minimum": 0,
      "maximum": 16,
      "units": "pixels",
      "required": false,
      "enumValues": [],
      "documentation": "Border width in target pixels; zero disables border drawing."
    },
    {
      "id": "visible",
      "displayName": "Visible",
      "kind": "boolean",
      "xmlName": "hide",
      "xmlAliases": [],
      "xmlTransform": "invertBoolean",
      "cppMember": "spec.visible",
      "defaultValue": true,
      "required": false,
      "enumValues": [],
      "documentation": "Initial visibility. XML stores the inverse historical hide flag."
    },
    {
      "id": "enabled",
      "displayName": "Enabled",
      "kind": "boolean",
      "xmlName": "enabled",
      "xmlAliases": [],
      "xmlTransform": "direct",
      "cppMember": "spec.enabled",
      "defaultValue": true,
      "required": false,
      "enumValues": [],
      "documentation": "Initial interaction state; disabled views remain renderable but cannot receive focus."
    },
    {
      "id": "focus-policy",
      "displayName": "Focus Policy",
      "kind": "enum",
      "xmlName": "canFocus",
      "xmlAliases": [],
      "xmlTransform": "triStateBoolean",
      "cppMember": "spec.focusable",
      "defaultValue": "auto",
      "required": false,
      "enumValues": ["auto", "false", "true"],
      "documentation": "Auto uses the widget default; true or false emits an explicit canFocus override."
    },
    {
      "id": "text",
      "displayName": "Text",
      "kind": "boundedText",
      "xmlName": "text",
      "xmlAliases": [],
      "xmlTransform": "direct",
      "cppMember": "spec.text",
      "defaultValue": "",
      "required": false,
      "enumValues": [],
      "documentation": "Borrowed UTF-8 display text whose storage must outlive the built layout."
    },
    {
      "id": "detail",
      "displayName": "Detail Text",
      "kind": "boundedText",
      "xmlName": "detail",
      "xmlAliases": [],
      "xmlTransform": "direct",